id_int,type,path_repository,id_ext,id_type,version,title_en,title_original,author_name,creator_contact,publisher,publication_date,lastupdate_date,publication_venue,description,URL_original,license,source_code,related_object_id,related_object_path,relation_description,curation _notes,metadata_updated_date,metadata_lastupdated_person,metadata_lastupdated_email
healthmap_alerts,visualization,NA,NA,NA,NA,Alerts for Novel Coronavirus (2019-nCoV),Alerts forNovel Coronavirus (2019-nCoV),HealthMap,NA,HealthMap,NA,2/11/20,Dedicated webpage,Map with alerts of 2019 nCoV occurrence extracted from online news reports; a saved search for 2019 Novel Coronavirus from the larger HealthMap disease altert collection.,https://healthmap.org/wuhan/,HealthMap terms of use (http://www.diseasedaily.org/about/termsofuse),No,NA,NA,NA,NA,2020-02-11,"Wilbert van Panhuis, University of Pittsburgh",wgvanpanhuis@gmail.com
healthmap_casedata,visualization,NA,NA,NA,NA,Novel Coronavirus (2019-nCoV),Novel Coronavirus (2019-nCoV),"John Brownstein (John.Brownstein@childrens.harvard.edu), Emily Cohn (Emily.Cohn@childrens.harvard.edu), Lauren Goodwin (Lauren.Goodwin@childrens.harvard.edu), Bernardo Gutierrez (bernanrdo.gutierrez@zoo.ox.ac.uk), Sarah Hill (sarah.hill@zoo.ox.ac.uk), Erin Hulland (ehulland@uw.edu), Moritz Kraemer (moritz.kraemer@zoo.ox.ac.uk), Sabrina Li (sabrina.li@ouce.ox.ac.uk), Alyssa loskill (	aloskill@bu.edu), Sumiko Mekaru (srmekaru@gmail.com), Julia Morgan (morgaj5@uw.edu), Katelynn O'Brien (katelynn.obrien@childrens.harvard.edu), David Pigott (pigottdm@uw.edu), Oliver Pybus (oliver.pybus@zoo.ox.ac.uk), Sam Scarpino (s.scarpino@northeastern.edu), Kara Sewalk (Kara.Sewalk@childrens.harvard.edu), Jessie Wu (chiehhsi.wu@gmail.com), Bo Xu (xu-b15@mails.tsinghua.edu.cn), Alex Zabreski (aezarebski@gmail.com). ",John.Brownstein@childrens.harvard.edu,HealthMap,NA,2/11/20,Dedicated webpage,"Map with case counts of cases at point coordinates at centroid of reporting location, cases exclusively collected from publicly available news and media. Data taken from line listing format entered data and stored in Github repository.",https://healthmap.org/ncov2019/,NA,No,line_listings_oxford_github,C:\Projects\2019-ncov\data\cases\global\line_listings_oxford_github,Data repository used for visualization,NA,2020-02-11,"Wilbert van Panhuis, University of Pittsburgh",wgvanpanhuis@gmail.com
chinacdc_dashboard,dashboard,NA,NA,NA,NA,Distribution of new coronavirus pneumonia,新型冠状病毒肺炎疫情分布,China Centers for Disease Control,NA,China Centers for Disease Control,NA,2/11/20,Dedicated webpage,"Dashboard showing spatial distribution of  confirmed and suspected cases, and deaths as new cases per day and cumulative case numbers. ",http://2019ncov.chinacdc.cn/2019-nCoV/,NA,No,NA,NA,NA,NA,2020-02-11,"Wilbert van Panhuis, University of Pittsburgh",wgvanpanhuis@gmail.com
nyt_outbreaktracker,visualization,NA,NA,NA,NA,Coronavirus Map: Tracking the Spread of the Outbreak,Coronavirus Map: Tracking the Spread of the Outbreak,"K.K. Rebecca Lai, Jin Wu, Allison McCann, Derek Watkins, Jugal K. Patel, Richard Harris",NA,New York Times,NA,2/11/20,New York Times webpage,"Webpage with maps of case counts from various sources for province centroids in China, per country globally, and per state in the US. ",https://www.nytimes.com/interactive/2020/world/asia/china-wuhan-coronavirus-maps.html?smid=nytcore-ios-share,NA,No,NA,NA,NA,NA,2020-02-11,"Wilbert van Panhuis, University of Pittsburgh",wgvanpanhuis@gmail.com
hopkins_csse_globalcases,dashboard,NA,NA,NA,NA,Coronavirus COVID-19 Global Cases by Johns Hopkins CSSE,Coronavirus COVID-19 Global Cases by Johns Hopkins CSSE,"Lauren Gardner, Aleksa Zlojutro, David Rey, Ensheng Dong.",jhusystems@gmail.com,Johns Hopkins University,NA,2/11/20,Dedicated webpage,"Dashboard showing case counts by province/city in China and globally, as total confirmed cases and deaths, and total recovered cases. A related Github repository lists daily snapshots of the case data and a time series compilation of new cases per day for provinces in China and locations outside of China. All data are derived from publicly available data from WHO, CDC, ECDC, NHC, and DXY. ",https://gisanddata.maps.arcgis.com/apps/opsdashboard/index.html#/bda7594740fd40299423467b48e9ecf6,"This website and its contents herein, including all data, mapping, and analysis (“Website”), copyright 2020 Johns Hopkins University, all rights reserved, is provided to the public strictly for educational and academic research purposes. The Website relies upon publicly available data from multiple sources, that do not always agree. The Johns Hopkins University hereby disclaims any and all representations and warranties with respect to the Website, including accuracy, fitness for use, and merchantability. Reliance on the Website for medical guidance or use of the Website in commerce is strictly prohibited.",No,Github repository,https://github.com/CSSEGISandData/COVID-19/tree/master/time_series,Data repository used for visualization,"Links to data sources and related Google Sheet also given on the resource landing page, see URL_original",2020-02-11,"Wilbert van Panhuis, University of Pittsburgh",wgvanpanhuis@gmail.com
coronavirus_interactive_global_dist,visualization,NA,NA,NA,NA,Realtime interactive map of coronavirus 2019-nCov global distribution,Realtime interactive map of coronavirus 2019-nCov global distribution,Matt Malishev,matthew.malishev@gmail.com,Individual,NA,2/16/20,Dedicated webpage,Realtime updates of 2019-nCov global distribution from live scraped data from the European Centre for Disease Prevention and Control (ECDC).,https://darwinanddavis.github.io/worldmaps/coronavirus.html,NA,Yes,Github repository,https://github.com/darwinanddavis/worldmaps/tree/gh-pages,Data repository used for visualization,Github repo contains dataviz source code and csv file of country latitudes longitudes,2020-02-17,Matt Malishev,matthew.malishev@gmail.com
